sentence_id,speech_id,year,president,speaker,regime,sentence_number,sentence,primary_theme,secondary_theme,policy,tense
1_5,1,1993,김영삼,김영삼,보수,5,"그러나 문민 민주화를 향해 우리가 걸어온 고난에 찬 력정에서 볼 때, 광주 민주화 운동은 우뚝한 한 봉우리를 차지하고 있습니다",T7,[],False,현재
1_9,1,1993,김영삼,김영삼,보수,9,"80년 5월의 민주화 운동, 그리고 87년 6월 항쟁을 통해 마침내 우리는 이 땅에 문민 민주정부를 세웠습니다",T7,[],False,과거
1_15,1,1993,김영삼,김영삼,보수,15,"광주의 유혈을 막지 못한 책임을 통감하면서, 잃어 버린 민주주의를 되찾기 위해서였습니다",T1,[],False,과거
1_16,1,1993,김영삼,김영삼,보수,16,분명히 말하거니와 오늘의 정부는 광주 민주화 운동의 연장선에 있는 민주정부입니다,T7,[],False,현재
1_17,1,1993,김영삼,김영삼,보수,17,"광주 민주화 운동의 부권과 명예회복, 그리고 그때의 상처와 아픔을 치유하기 위하여 광주 시민 여러분과 같은 입장에 서서 고뇌하는 정부입니다",T5,"[""T7""]",False,현재
1_18,1,1993,김영삼,김영삼,보수,18,또한 문민 정부의 출범과 그 개혁은 광주 민주화 운동의 역사적 의미를 실현시켜 나가는 과정입니다,T7,[],False,현재
1_19,1,1993,김영삼,김영삼,보수,19,광주문제는 더 이상 앙금으로 남아 있어서는 안됩니다,T3,[],False,현재
1_20,1,1993,김영삼,김영삼,보수,20,"결코 정치적 목적으로 이용되거나, 정쟁의 대상이 되어서는 안됩니다",T3,[],False,현재
1_22,1,1993,김영삼,김영삼,보수,22,광주의 아픔은 치유되고 명예회복도 이루어져야 한다고 믿습니다,T5,[],False,현재
1_23,1,1993,김영삼,김영삼,보수,23,"그것은 광주의 고통을 온국민이 함께 나누고, 광주의 민주정신을 전국적으로 승화시키는 방향에서, 그리고 광주 시민이 원하고 국민 모두가 공감할 수 있는 방향에서 이루어져야 할 것입니다",T6,"[""T3""]",False,미래
1_24,1,1993,김영삼,김영삼,보수,24,"첫째, 5·18 광주 민주화 운동의 정신을 기리고 그 명예를 높일 수 있는 사업을 적극 지원할 것입니다",T6,[],True,미래
1_25,1,1993,김영삼,김영삼,보수,25,"우선, 광주 시민과 온국민이 그날을 기념할 수 있도록 광주시에서 기념일을 먼저 제정하기를 희망합니다",T6,[],True,미래
1_26,1,1993,김영삼,김영삼,보수,26,망월동 묘역은 민주성지로 가꾸어 나갈 수 있도록 묘역의 확장 등 필요한 지원을 다할 것입니다,T6,[],True,미래
1_27,1,1993,김영삼,김영삼,보수,27,"광주 시민과 전남 도민의 의사에 따라 현재 광주 시내에 있는 전남도청을 전남도 관내로 이전하고, 당시 민주화 운동의 현장이었던 현 도청 위치에 5·18 광주 민주화 운동 기념공원을 조성하고 기념탑을 세우는 방안을 적극 검토, 지원할 것입니다",T6,[],True,미래
1_28,1,1993,김영삼,김영삼,보수,28,현재 상무대 부지의 일부를 광주시에 추가로 무상 사용케 함으로써 시민공원을 조성하도록 할 것입니다,T6,[],True,미래
1_29,1,1993,김영삼,김영삼,보수,29,"둘째, 광주 민주화 운동과 관련하여 아직까지 억울한 처지에 있는 분들을 위로하는 데 필요한 모든 노력과 지원을 다할 것입니다",T5,[],False,미래
1_30,1,1993,김영삼,김영삼,보수,30,사망자와 행방 불명자 및 부상자 중에서 아직까지 법률에 의하여 보상을 받지 못한 분들을 위하여 추가 신고기회를 제공할 것입니다,T5,[],True,미래
1_31,1,1993,김영삼,김영삼,보수,31,"당시 연행, 구금되거나 유죄판결을 받아 사면ㆍ복권된 분들에 대하여 전과기록을 완전히 말소하고 지원방안을 강구하는 등 그분들이 이 나라의 민주화에 헌신한 만큼 떳떳하게 그 명예가 회복되도록 할 것입니다",T5,[],True,미래
1_32,1,1993,김영삼,김영삼,보수,32,"당시 부상을 당하신 분 중, 앞으로도 치료가 필요한 분들에 대해서는 계속적인 치료가 가능하도록 지원하겠습니다",T5,[],True,미래
1_33,1,1993,김영삼,김영삼,보수,33,5·18 광주 민주화 운동과 관련하여 지명수배를 받은 분들에 대해서는 공식적으로 이를 해제하고 해직된 분들에 대한 복직 역시 적극 검토할 것입니다,T5,[],True,미래
1_34,1,1993,김영삼,김영삼,보수,34,"저는 우리의 법체계 안에서 가능하고, 형평의 원칙에 비추어 합리적인 모든 조치를 취해 나갈 것입니다",T5,[],True,미래
1_37,1,1993,김영삼,김영삼,보수,37,저는 광주 민주화 운동에 대한 진상규명과 그 책임자 처벌을 요구하는 주장이 있다는 것을 잘 알고 있습니다,T4,[],False,현재
1_38,1,1993,김영삼,김영삼,보수,38,그것을 위해 특별한 조치를 취해야 한다는 주장도 있다고 듣고 있습니다,T4,[],False,현재
1_39,1,1993,김영삼,김영삼,보수,39,저는 그러한 주장이 있을 수 있다고 생각합니다,T4,[],False,현재
1_41,1,1993,김영삼,김영삼,보수,41,그러나 진상규명은 역사를 올바르게 바로잡고 정당한 평가를 받자는 데 그 목적이 있습니다,T4,[],False,현재
1_42,1,1993,김영삼,김영삼,보수,42,결코 암울했던 시절의 치욕을 다시 들추어 내어 갈등을 재연하거나 누구를 벌하자는 것은 아닐 것입니다,T3,"[""T4""]",False,미래
1_43,1,1993,김영삼,김영삼,보수,43,"따라서, 지금 이 시점에서 중요한 것은 우리 국민 모두가 5·18 광주 민주화 운동의 명예를 높이 세우는 일입니다",T5,[],False,현재
1_44,1,1993,김영삼,김영삼,보수,44,진상규명과 관련하여 미흡한 부분이 있다면 이는 훗날의 역사에 맡기는 것이 도리라고 믿습니다,T4,[],False,현재
1_45,1,1993,김영삼,김영삼,보수,45,진실은 역사 속에서 반드시 밝혀지고 만다는 것이 저의 확신입니다,T4,[],False,현재
1_46,1,1993,김영삼,김영삼,보수,46,"이제, 마음과 갈등의 고리를 바로 우리 모두의 손으로 끊어야 한다고 생각합니다",T3,[],False,현재
1_47,1,1993,김영삼,김영삼,보수,47,오늘에 다시 보부적 한풀이가 되어서는 안된다고 생각합니다,T3,[],False,현재
1_48,1,1993,김영삼,김영삼,보수,48,우리 다같이 잊지는 말되 과감하게 용서함으로써 새롭게 화해하자고 말하고 싶습니다,T2,"[""T3"", ""T6""]",False,현재
1_49,1,1993,김영삼,김영삼,보수,49,용서하는 것만큼 큰 용기는 없습니다,T2,[],False,현재
1_50,1,1993,김영삼,김영삼,보수,50,그렇게 함으로써 우리 모두 13년 전의 악몽과 멍에로부터 자유로워집시다,T3,"[""T2""]",False,현재
1_52,1,1993,김영삼,김영삼,보수,52,광주 민주화 운동의 정신은 ‘신한국 창조’를 향한 참여와 창의의 열린 정신으로 승화되어야 합니다,T6,[],True,미래
1_54,1,1993,김영삼,김영삼,보수,54,"저는 광주가 과거에 매달려 있는 도시가 아니라 그 이름처럼 빛을 비추이는 도시, 우리 조국의 미래를 열어 나가는 밝은 도시로 새롭게 태어날 수 있도록 저와 우리 정부가 할 수 있는 모든 지원과 노력을 다 할 것임을 거듭 말씀드립니다",T5,[],True,미래
1_55,1,1993,김영삼,김영삼,보수,55,"저는 국민 여러분께 약속한 대로, 동서의 화해와 정의로운 국민 내부의 화해를 이룩해 나가는 데 혼신의 노력을 다 기울이겠습니다",T3,[],True,미래
1_58,1,1993,김영삼,김영삼,보수,58,저는 그것을 새롭게 일어선 광주 시민 여러분과 함께 해내고 싶습니다,T3,[],False,현재
2_6,2,1997,김영삼,총리(고건),보수,6,"돌이켜 보면, 5·18 민주화운동은 이 나라 민주주의를 지키기 위한 의로운 시민들의 결기이며 항쟁이었습니다",T7,[],False,과거
2_7,2,1997,김영삼,총리(고건),보수,7,어떠한 폭압에도 굴하지 않은 5·18 민주화운동의 정신은 지난 17년동안 수많은 국민들의 삶과 마음속에 계승되어 왔습니다,T6,[],False,과거
2_12,2,1997,김영삼,총리(고건),보수,12,이제 우리 국민 모두는 지난 1980년 5·18 민주화운동으로 인한 희생자와 피해자는 물론 광주시민들이 그동안 겪은 깊은 마음의 상처에 대해 심심한 위로를 드려야 하겠습니다,T5,[],False,미래
2_14,2,1997,김영삼,총리(고건),보수,14,이제 더 이상 5·18은 원한의 시발점이 아니라 수많은 민주시민들의 이 땅의 민주화에 온몸으로 기여한 역사적 사실을 기리는 축복의 시작이 되어야 합니다,T7,"[""T3""]",False,미래
2_15,2,1997,김영삼,총리(고건),보수,15,물론 5·18의 실상을 직접 겪은 광주시민 여러분께서는 1980년 5월의 비극을 결코 잊을 수 없을 것입니다,T6,"[""T5""]",False,미래
2_16,2,1997,김영삼,총리(고건),보수,16,그러나 불행했던 과거에 언제까지 집착할 수만은 없습니다,T3,"[""T2""]",False,현재
2_17,2,1997,김영삼,총리(고건),보수,17,광주시민 여러분께서는 그동안의 맺힌 한을 이겨내는 능동적인 시민상을 이룩해 주시기를 기대해 마지 않습니다,T2,"[""T3""]",False,미래
2_18,2,1997,김영삼,총리(고건),보수,18,그리하여 5·18 민주화운동은 광주라는 지역의 한계를 벗어나 범국민적인 보편가치로 승화되어 모든 국민들 가슴속에 자리잡아야 합니다,T7,"[""T6""]",False,미래
2_19,2,1997,김영삼,총리(고건),보수,19,오늘의 5·18 제17주기를 계기로 이제 5월 18일은 우리나라 모든 국민들이 관용하고 화해하는 출발점이 되어야 할 것입니다,T3,"[""T2""]",False,미래
2_20,2,1997,김영삼,총리(고건),보수,20,그동안의 모든 미움과 갈등의 고리를 풀고 관용하고 용서하고 화해함으로써 모두가 하나가 되는 大統合을 이루어 새롭게 출발해야 한다고 저는 믿습니다,T3,"[""T2""]",False,현재
2_21,2,1997,김영삼,총리(고건),보수,21,'잊지는 말되 용서함으로써 새롭게 출발하자'는 관용과 화해의 정신이 아니고서는 그 무엇도 5·18 민주화운동의 진정한 계승에 도움이 되지 않을 것이라는 이 지역 원로의 말씀을 귀담아 들어야 하겠습니다,T2,"[""T3"",""T6""]",False,미래
2_22,2,1997,김영삼,총리(고건),보수,22,"우리 민족은 몇 천년동안 불교, 유교, 그리고 근대의 기독교 등의 신앙생활을 통해 자비와 사랑과 화해를 지향하는 삶을 살아왔습니다",T3,[],False,과거
2_23,2,1997,김영삼,총리(고건),보수,23,우리는 이제 5·18 민주화운동의 정신이 겨레의 가슴속에 영원히 살아 숨쉴 수 있는 길이 무엇인가를 다함께 생각해야 하겠습니다,T6,[],False,미래
2_24,2,1997,김영삼,총리(고건),보수,24,불의와 폭압에 항거했던 5·18정신을 영원한 자유와 정의 그리고 민주의 숭고한 가치로 후손들 모두가 가슴에 새겨나갈 수 있도록 하는 것이 우리가 5월 민주영령들의 고귀한 희생에 보답하는 길이라고 생각합니다,T6,"[""T7""]",False,현재
3_7,3,1998,김대중,총리(김종필),진보,7,돌이켜보면 5·18 민주화운동은 이 땅의 민주주의를 지키기 위해 폭압과 폭력에 항거하여 분연히 일어선 의로운 시민들의 항쟁이었습니다,T7,[],False,과거
3_8,3,1998,김대중,총리(김종필),진보,8,"5·18 민주화운동은 애국시민들의 뜨거운 민주열정을 불러일으킨 거대한 활화산이 되어, 언제까지나 이 나라 민주발전의 고귀한 밑거름이 될 것이라고 믿습니다",T6,"[""T7""]",False,현재
3_10,3,1998,김대중,총리(김종필),진보,10,"이제 5월 민주영령들은 이 나라 민주주의의 화신으로, 또 이 땅의 자유와 정의를 지키는 수호신으로 되살아나고 있다고 믿습니다",T6,"[""T7""]",False,현재
3_11,3,1998,김대중,총리(김종필),진보,11,"우리는 어떠한 폭압에도 굴하지 않은 5·18 민주화운동의 정신을 우리 역사와 민족의 삶 속에 소중히 간직하여, 영원히 이 나라 이 겨레의 자유와 민주를 지키는 등불로 삼아 나가야 할 것입니다",T6,"[""T7""]",False,미래
3_12,3,1998,김대중,총리(김종필),진보,12,"경애하는 국민 여러분, 그리고 광주시민 여러분. 이제 5·18 민주화운동은 더 이상 광주의 것만은 아닙니다. 5·18 민주화운동은 쉼없이 지속해 온 이 땅의 민주화 역정 가운데 우뚝 선 봉우리로서, 모든 지역 모든 국민의 가슴에 깊이 간직되고 있습니다",T7,"[""T6""]",False,현재
3_13,3,1998,김대중,총리(김종필),진보,13,나아가 5·18의 정신은 세계 모든 민주세력이 우러러 지향하는 민주주의운동과 인권사회운동의 상징이 되고 있습니다,T7,[],False,현재
3_14,3,1998,김대중,총리(김종필),진보,14,"5·18 민주화운동 18주년을 맞아 광주시민 여러분께서 펼치고 계신 ‘인권과 평화, 화합의 미래로’라는 주제처럼, 이제 5·18은 우리나라를 넘어 세계의 평화와 화합된 미래를 여는 새로운 출발점이 될 것이라고 굳게 믿습니다",T7,"[""T3""]",False,현재
3_17,3,1998,김대중,총리(김종필),진보,17,"이러한 때, 국민 모두는 이 나라를 위해 스스로를 던지신 5·18 민주영령들의 희생을 가슴깊이 새기면서, 오늘의 국가적 위기를 이겨내려는 결의를 굳게 다져야 하겠습니다",T6,"[""T5""]",False,미래
3_18,3,1998,김대중,총리(김종필),진보,18,"나라를 위해 자신의 작은 것을 버리고 다 함께 고통의 멍에를 나누는 것이 곧 5·18 민주영령들께서 오늘의 우리에게 바라는 바일 것이라고 믿습니다. 80년 5월, 그 날의 의미를 되새긴다면 우리는 어떠한 어려움도 반드시 극복해 나갈 수 있으리라 확신합니다",T6,"[""T5""]",False,현재
3_19,3,1998,김대중,총리(김종필),진보,19,5·18 정신이 민주발전의 초석이 되고 국난극복의 원동력으로 승화되어 나갈 수 있도록 우리 모두 온 힘을 다해야 하겠습니다,T6,"[""T7""]",False,미래
4_6,4,1999,김대중,총리(김종필),진보,6,"돌이켜보면, 5·18 민주화운동은 폭력과 억압으로부터 자유와 민주주의를 지키기 위해 분연히 일어섰던 의로운 시민들의 항쟁이었습니다",T7,[],False,과거
4_7,4,1999,김대중,총리(김종필),진보,7,"실로 5·18 민주화운동은 우리나라 민주화 여정에 우뚝 선 봉우리로서, 앞으로도 영원히 꺼지지 않는 민주주의의 횃불이 되리라 믿습니다",T7,"[""T6""]",False,현재
4_11,4,1999,김대중,총리(김종필),진보,11,나아가 5·18 민주화운동을 광주의 것만이 아니라 자유와 정의를 사랑하는 세계 모든 민주시민들이 우러러 지향해야 할 민주주의 운동의 상징으로 승화시켜 나가는 데도 힘을 모을 것입니다,T7,"[""T6""]",False,미래
4_12,4,1999,김대중,총리(김종필),진보,12,이제 우리 국민 모두는 5·18 민주화운동의 정신을 가슴깊이 간직하고 새로운 21세기를 희망의 시대로 열어 나가려는 결의를 굳게 해야 하겠습니다,T6,"[""T7""]",False,미래
4_13,4,1999,김대중,총리(김종필),진보,13,5·18 정신이 겨레의 가슴속에 영원히 살아 숨쉬면서 민주주의 발전의 초석이 되고 국난극복의 원동력이 될 수 있도록 우리 모두 온 정성을 다해야 하겠습니다,T6,"[""T7""]",False,미래
4_15,4,1999,김대중,총리(김종필),진보,15,우리는 그 동안의 갈등의 고리를 끊고 국민 모두가 하나가 되어서 대화해를 이룩한 가운데 미래를 향해 출발해야 할 것입니다,T3,"[""T2""]",False,미래
4_16,4,1999,김대중,총리(김종필),진보,16,이것이야말로 목숨을 바쳐 이 나라의 자유와 민주를 지켜내신 5·18 민주영령들의 고귀한 희생을 더욱 값지게 하는 길이라고 믿습니다,T6,"[""T3""]",False,현재
4_17,4,1999,김대중,총리(김종필),진보,17,그 어려운 상황 속에서도 나라를 위해 떨쳐 일어섰던 19년 전의 5·18 정신을 되새긴다면 우리는 어떠한 난관도 극복해낼 수 있으리라고 기대합니다,T6,"[""T5""]",False,현재
5_4,5,2000,김대중,김대중,진보,4,20년전 오늘 민주주의 수호를 위해 고귀한 생명을 불사른 민주영령 앞에 이제 저는 대한민국 대통령으로서 서 있습니다,T6,"[""T7""]",False,현재
5_5,5,2000,김대중,김대중,진보,5,"이름만 불러도 가슴이 저미는 충장로와 금남로, 그리고 전라남도 도청에서 빛도 없이 쓰러져간 수많은 민주주의의 영웅들을 생각할 때마다 저는 한없는 슬픔과 감동, 그리고 새로운 각오를 갖게 됩니다",T6,"[""T7""]",False,현재
5_12,5,2000,김대중,김대중,진보,12,"가신 임들을 위해서, 그리고 이 나라 민주주의를 위해서 내가 할 수 있는 일은 그분들의 뒤를 따라 정의롭게 죽는 것 뿐이라고 생각했습니다",T6,[],False,과거
5_13,5,2000,김대중,김대중,진보,13,"그것만이 민주영령과 국민, 그리고 역사 앞에 영원히 사는 길이라고 결심했습니다",T6,[],False,과거
5_18,5,2000,김대중,김대중,진보,18,임들이 스스로의 몸으로 불살랐던 민주화의 불꽃은 그 후 암흑같은 독재의 치하에서도 꺼지지 않고 불타올랐습니다,T7,"[""T6""]",False,과거
5_19,5,2000,김대중,김대중,진보,19,"줄기찬 민주화의 불길은 87년 6월 전국적인 시민항쟁으로 번져나갔고, 마침내 97년 12월 헌정사상 최초의 여야간 정권교체를 이루는 민주주의의 커다란 성취로 이어졌던 것입니다",T7,[],False,현재
5_20,5,2000,김대중,김대중,진보,20,위대한 광주의 정신이 살아서 승리한 것입니다,T7,"[""T6""]",False,현재
5_21,5,2000,김대중,김대중,진보,21,그에 따라 '폭도'로 몰렸던 그날의 광주시민은 이제 민주주의의 위대한 수호자로서 전 세계인의 추앙을 받고 있습니다,T5,"[""T7""]",False,현재
5_23,5,2000,김대중,김대중,진보,23,오늘 5·18 민주화운동 20주년을 맞아 저는 이 나라 민주제단에 몸을 던져 산화하신 임들의 고귀한 영전에 다시한번 뜨거운 추모를 올리면서 삼가 명복을 빌어마지 않습니다,T6,[],False,미래
5_24,5,2000,김대중,김대중,진보,24,또한 오늘 이 순간까지 그날의 상처로 슬픔과 고통을 겪고 계신 유가족과 부상자 여러분에게도 충심으로 위로의 말씀을 드립니다,T5,[],False,현재
5_27,5,2000,김대중,김대중,진보,27,5·18의 광주는 우리에게 위대한 교훈을 남겨 주었습니다,T6,"[""T7""]",False,과거
5_29,5,2000,김대중,김대중,진보,29,5·18에서 우리가 보았던 첫 번째 정신은 인권정신이었습니다,T7,[],False,과거
5_30,5,2000,김대중,김대중,진보,30,불의한 권력의 무자비한 폭력에 맞서서 광주는 인간의 소중한 권리를 지키고자 싸웠습니다,T7,[],False,과거
5_33,5,2000,김대중,김대중,진보,33,둘째는 비폭력의 정신이었습니다,T7,[],False,과거
5_34,5,2000,김대중,김대중,진보,34,광주시민은 맨손으로 잔혹한 총칼에 맞섰습니다,T7,[],False,과거
5_36,5,2000,김대중,김대중,진보,36,무기를 손에 넣고도 결코 이를 사용해서 누구에게도 살상을 가하지 않았습니다,T7,[],False,과거
5_37,5,2000,김대중,김대중,진보,37,철저한 비폭력의 정신이었던 것입니다,T7,[],False,현재
5_38,5,2000,김대중,김대중,진보,38,셋째는 성숙한 시민정신이었습니다,T7,[],False,과거
5_39,5,2000,김대중,김대중,진보,39,공권력의 공백 속에서도 광주에는 단 한건의 약탈이나 방화도 없었습니다,T7,[],False,과거
5_40,5,2000,김대중,김대중,진보,40,그 어떤 혼란이나 무질서도 없었습니다,T7,[],False,과거
5_41,5,2000,김대중,김대중,진보,41,시민 모두가 동지애와 높은 질서의식을 가지고 서로를 보살피고 치안을 지켰습니다,T7,[],False,과거
5_42,5,2000,김대중,김대중,진보,42,이것은 세계에서도 유례없는 일입니다,T7,[],False,현재
5_43,5,2000,김대중,김대중,진보,43,넷째는 평화의 정신이었습니다,T7,[],False,과거
5_44,5,2000,김대중,김대중,진보,44,"시민자치가 이루어진 열흘동안 어떠한 보복도 없었으며, 광주시민들은 진압군 측과 대화를 시도하는 등 항쟁의 평화적 해결을 위해 부단히 노력했습니다",T7,[],False,과거
5_47,5,2000,김대중,김대중,진보,47,광주시민의 행동이야말로 인간이 극한 상황에서도 얼마나 위대한 선택을 할 수 있는지를 보여준 인간승리의 대서사시였기 때문입니다,T7,[],False,현재
5_48,5,2000,김대중,김대중,진보,48,이제 우리는 5·18 광주항쟁이 구현한 고귀한 뜻과 정신이 영원히 살아 숨쉬도록 해야 합니다,T6,"[""T7""]",False,미래
5_49,5,2000,김대중,김대중,진보,49,지나간 과거가 아니라 언제나 현재로서 뜨겁게 불타오르도록 해야 합니다,T6,[],False,미래
5_53,5,2000,김대중,김대중,진보,53,"그런 점에서 저는 광주시민과 5·18 기념행사위원회가 다양한 국제적 교류를 통해 5·18의 역사적 의의와 공헌을 재조명하고, 전 세계 민주시민과의 연대와 협력을 다지고 있는 것을 매우 뜻깊고 바람직하게 생각하는 바입니다",T6,"[""T7""]",True,현재
5_54,5,2000,김대중,김대중,진보,54,정부는 5·18 항쟁의 고귀한 정신과 값진 헌신이 역사 속에 영원히 기억되고 크게 선양될 수 있도록 최선의 노력을 다할 것입니다,T6,"[""T5""]",True,미래
5_55,5,2000,김대중,김대중,진보,55,특별법을 조속히 제정하겠습니다,T5,[],True,미래
5_56,5,2000,김대중,김대중,진보,56,"그에 따라 『광주민주화운동 관련자 보상 등에 관한 법률』에 의해 보상을 받았거나 앞으로 받게될 모든 5·18 희생자들을 '민주화 유공자'로 예우하고, 5·18 묘역을 국립묘지로 승격시킬 것입니다",T5,"[""T6""]",True,미래
5_57,5,2000,김대중,김대중,진보,57,"이와 함께 각종 기념사업을 실시하여 5·18 민주화운동에 참여했던 분들의 명예와 자긍심을 높이고, 5·18의 숭고한 정신을 길이 계승, 발전시켜 나갈 것입니다",T5,"[""T6""]",True,미래
5_59,5,2000,김대중,김대중,진보,59,"이 땅에 살고 있는 사람들 중 그 어느 누가 그날의 광주에 빚지지 않은 사람이 있겠습니까, 이제는 우리가 살아남은 사람들로서의 의무를 다해야 할 때입니다",T7,"[""T6""]",False,미래
5_70,5,2000,김대중,김대중,진보,70,화해와 대화합의 시대를 열어가야 합니다,T3,[],False,미래
5_71,5,2000,김대중,김대중,진보,71,그것이야말로 가신 임들의 고귀한 뜻을 받드는 길입니다,T6,"[""T3""]",False,현재
5_72,5,2000,김대중,김대중,진보,72,5·18 광주정신을 완성하는 길인 것입니다,T7,"[""T3""]",False,현재
5_73,5,2000,김대중,김대중,진보,73,"광주민주화운동 20주년이 되는 오늘을 기해서 이제 지역간, 계층간의 모든 분열과 대립을 종식시켜야 하겠습니다",T3,[],False,미래
5_74,5,2000,김대중,김대중,진보,74,특히 망국적인 지역감정의 사슬을 단호히 끊고 화합과 협력의 새 시대로 힘차게 나아가야 하겠습니다,T3,[],False,미래
5_75,5,2000,김대중,김대중,진보,75,나아가서 우리는 남북이 평화의 토대 위에서 서로 협력하고 공존공영하는 민족의 대화합을 이룩해야 합니다,T3,[],False,미래
5_78,5,2000,김대중,김대중,진보,78,우리는 이번 회담이 민족사의 물줄기를 신뢰와 화합으로 돌려놓는 커다란 분수령이 되도록 노력해야 하겠습니다,T3,[],False,미래
5_79,5,2000,김대중,김대중,진보,79,민족의 장래를 크게 열어가는 이 일에 온 국민이 하나가 되어야 하겠습니다,T3,[],False,미래
5_80,5,2000,김대중,김대중,진보,80,그것이야말로 5·18 민주영령들의 값진 희생에 보답하고 후손들에게 자랑스러운 조상이 되는 길이라는 것을 저는 확신해 마지 않습니다,T6,"[""T3""]",False,미래
5_82,5,2000,김대중,김대중,진보,82,5·18은 우리 가슴 속에 영원히 살아 있을 것입니다,T6,[],False,미래
5_83,5,2000,김대중,김대중,진보,83,우리 모두에게 민주주의의 앞길을 밝히는 불멸의 횃불이 될 것입니다,T6,"[""T7""]",False,미래
6_5,6,2001,김대중,총리(이한동),진보,5,"돌이켜보면, 5·18민주화운동은 부당한 압제에 짓밟힌 민주주의와 인권, 그리고 자유를 지키기 위해 일어섰던 의로운 시민들의 항쟁이었습니다",T7,[],False,과거
6_7,6,2001,김대중,총리(이한동),진보,7,실로 5·18민주화운동은 이 땅의 자유민주주의를 되살리기 위해 분연히 결기한 반독재 민주투쟁으로서 우리 민주화 여정에 우뚝선 봉우리가 되고 있다고 믿습니다,T7,[],False,현재
